{
  "schema_version": 1,
  "season": 2026,
  "period": {
    "kind": "preseason-prior",
    "week": null,
    "label": "Phase 6 preseason prior"
  },
  "frozen_at": "2026-08-27T17:00:59.275Z",
  "public_manifest": {
    "id": "public-2026-20260827T170059.275Z-f780daea0818",
    "path": "data/weekly/manifests/public-2026-20260827T170059.275Z-f780daea0818.json",
    "sha256": "ba891a1bdde4010722755dab445a08829cc533754f7b45ce9cdf92f3c5024130"
  },
  "evidence": {
    "id": "evidence-2026-ca6a8d83192f78a7",
    "path": "data/evidence/2026-evidence-ledger.json",
    "sha256": "98f26a292c4a4ac5da1829b58690bd3e07ed26cc39cf95ad770c8ff5b76ba24b"
  },
  "forecast": {
    "id": "fcst-2026-preseason-bf554ba7c4aee595",
    "path": "data/forecasts/fcst-2026-preseason-bf554ba7c4aee595.json",
    "sha256": "58feb9a4847284c4644f78822cb1aea48d06b35da0a19612beb955898b1cd972"
  },
  "market": {
    "id": "kalshi-exec-20260827T153038.207Z",
    "path": "data/markets/20260827T153038.207Z-kalshi-nfl-execution.json",
    "sha256": "94020514d50964701738c9332e2f027c8c7303de1994fdb33cc224d7863d1e82"
  },
  "readiness": {
    "id": "readiness-20260827T170059.275Z",
    "path": "data/audit/20260827T170054Z-decision-system-readiness.json",
    "sha256": "ede6904b13d9f509c9cf018b317daa7a8f4d115ed36200b192645ddef3d50647"
  },
  "policies": [
    {
      "id": "freshness-2026.1",
      "path": "config/freshness-policy.json",
      "sha256": "7ab4ef00a2a8e5d5827c539a591e7dd82a0893e6a6a2cd67cd7abb6a3f4e308b"
    },
    {
      "id": "forecast-policy-2026.1",
      "path": "config/forecast-policy.json",
      "sha256": "a7cbb3d3c0941e001f0936e0de2958bc89a2c25b70c27f2cf9509a2de6abe956"
    },
    {
      "id": "market-policy-2026.2",
      "path": "config/market-policy.json",
      "sha256": "78b963619ce2cca1bdd2f6961ff288bfdf0fef79c41b43b8ca91bb5ec43a6e1e"
    },
    {
      "id": "source-registry-2026.2",
      "path": "config/source-registry.json",
      "sha256": "4abc69e535fcb0545b2a736de265beef9abae88fcffea7131c6b26755a0eaa49"
    },
    {
      "id": "learning-policy-2026.1",
      "path": "config/learning-policy.json",
      "sha256": "04b8b643e55ba6bf193ab9c83dc82c4c6f685719a9ffdb69f0405ef3796af814"
    }
  ],
  "weekly_state_version_id": "weekly-2026-preseason-prior-3c7ab67d2d4db794",
  "content_fingerprint": "3c7ab67d2d4db79443389b56d0b0feff4ec77ea058911644d08ad02536703665"
}
